text;klasifikasi
if you failed to convict  for january th  n you all are complicit;Negatif
those people chanting thank you  must be paid  ir faces didn t match   enthusiastic chant    o;Netral
 y supposedly had enough republican senators willing to convict will we ever know  se cowards names  was not ca;Negatif
even if   senate votes to convict    n votes to bar him from running again i still think we should let him have h;Negatif
congress better impeach  convict  so he never holds office again  does not sell intelligence to russia;Negatif
we will be back in some form  sniveled stop him now impeached twice so now we convict  bar future office holding;Negatif
we will see you soon that sounds like a threat to me we cannot have this please convict him ;Negatif
you must convict  you know he is guilty he must never be allowed to run for office again we will;Negatif
donald  has been impeached twice he incited an insurrection that resulted in loss of life while   nation watched;Netral
 we ll be back in some form me we need to convict this asshole so he cannot run again;Negatif
you re completely disregarding  discounting   split that is about to ha;Netral
 is playing to   republicans in   senate now hoping  y won t vote to convict him in   impeachment trial;Negatif
today is an important day  biden harris bring immediate hope  action but this is a reminder of   legacy;Netral
 is less worried about being barred from running from office again  more concerned with   optics of being conv;Netral
we re gonna try  first though  hopefully convict   bastard;Negatif
sir kim darroch former us ambo to uk in senators can ei r move on amp reassert traditional republican value;Netral
you have a forthcoming vote on former president donald j  coming up we will be watching we expe;Netral
 lies in his final speech as president;Netral
yes   senate will vote to convict  will form a new fringe politcal party   g;Negatif
what information does julian assange have on mitch mcconnell that he so feared being released he was willing to vo;Netral
holy sh t race has nothing to do with it you need votes in   senate to convict  it would have been very;Negatif
president  has left   white house for   last time note he began his political career peddling   racist conspirac;Netral
this may be   leverage for mcconnell to swing those extra republican votes needed to convict  in   senate;Negatif
now is   time to convict    make sure he never has a chance to come back is a loser ;Negatif
why is  using his parting words as a rally why are  y airing this shit be careful gop if you don t con;Netral
are you going to continue   lies convict ;Negatif
watching  this am it s a waste of taxpayers money getting this traitor out of washington he should have been;Netral
i will never forget how we bed toge r to rid   usa of  or how narrowly we defeated   specter of fascism rul;Netral
on where senate majority leader mitch mcconnell may st on pres  s impeachment he s sent sig;Netral
to not convict  will be a travesty of justice we know   chances are slim   d;Negatif
i suspect this will encourage to suddenly discover reasons to convict  in   impeachment trial;Negatif
now let s see which republicans do   right  honorable next step by voting to convict  you;Negatif
 divided our country as such  wasn t president to all but instead just a two;Netral
yes but   o r half now have a chance to get re elected  convict ex president ;Negatif
president  just left   white house for   very last time as president;Netral
 has disgraced   united states of america now convict him a;Negatif
sir kim darroch former us ambo to uk in senators can ei r move on amp reassert traditional republi;Netral
is   most disgraced in us history   must convict him on charge;Negatif
 hopefully it s not a long good bye me mcconnell you better convict  ban him;Negatif
 is just as much a threat out of office as in pressure to convict should be immense a new party is going to;Negatif
if  s reasoning on not pardoning assange amp snowden is that he cut a deal that senate r s wouldn t vote to convict him d;Negatif
thats good mouve as president  did put  m to  ir convict under mr president    only p;Negatif
just hours before he left office  revoked a rule he signed that imposed a five year lobbying ban for admin official;Netral
she stormed   capitol threatened   lives of congress tried to overthrow   government while shouting in   migh;Netral
 incited a mob of white supremacists  domestic terrorists to attack our capitol if congress fails to impeach  co;Netral
  fact that he s arriving to   same song  y blared as   whipped up   mob that stormed   capitol it s t;Netral
ano r prediction  will announce a presidential run before congress votes to convict acquit in an attem;Negatif
a perfectly corrupt end to a corrupt to   core presidency with  pardoning those who broke   public trust who com;Netral
you don t get to throw matches on dry timber  n deny you lit   fire criminal x i;Netral
well if we are just talking   ignoring allegations against numerou;Netral
yes  y could but gop senators should convict him anyway anyone who makes a deal with trum;Negatif
 using pardons like mob favors owed is yet ano r reason   senate should convict this sets a new low bar;Negatif
as  said farewell leaving   white house he said he hoped it wouldn t be a long goodbye gotta be a permanent goodbye;Netral
more importantly all but lonely gop senators want to convict  in his second impeachment;Negatif
as  said farewell leaving   white house he said he hoped it wouldn t be a long goodbye gotta be a permanen;Netral
i m sure mitch mcconnell is aware that is why he has been finger pointing   blaming him for  ;Netral
  need to impeach convict  is to set a limit on extremes a president can behave or not also to set   cons;Negatif
justice is more important than unity convict  at his impeachment trial rep alma adams;Negatif
rarely if ever has a simple timeline been more damning this one should lead   senate to convict donald j   bar hi;Negatif
west virginia sen manchin evidence to convict  overwhelming says  should face criminal charges;Negatif
best day ever next time  is in washington is when he testifies impeached  convict;Negatif
he s too damaged even if   senate fails to convict years removed years of ameri;Negatif
i don t think it s an empty threat at all hell  y will probably vote to;Netral
 echoes civil war era racism convict him;Negatif
i call for   senate to immediately convict amp disqualify former president donald  for his attempted coup on t;Negatif
this retired republican christian coalition regional director doctor of pharmacy bible college;Netral
convict ;Negatif
america dodged a bullet on january th however let s continually remind one ano r that   man who held  ;Netral
it will also be   incentive for   repub senators to convict  y cant afford to have him siphoning off mo;Negatif
in order to convict president  guilty of a crime you must find him intentional guilt what i mean is t;Negatif
convict  please retweet;Negatif
if   gop senators don t vote to convict  for inciting;Negatif
i hate  with a passion i am ecstatic that he is going to be plain old loser  from now on hopefully he w;Netral
not to mention continuing to whip up support for  s nefarious schemes   states should convict  se people tha;Negatif
this retired republican christian coalition regional director doctor of pharmacy bible college grad;Netral
even more reason for   gop senators to convict  doing this will dilute   rep vote to   poin;Negatif
let  pardon all his cronies every last one of  m it ll be his kiss of death senate republicans will be pi;Netral
he ll likely run in with gop that s why dems are so frightened  desperate to impeach convict;Negatif
this retired republican christian coalition regional director doctor of pharmacy bible;Netral
he told people to fight to march  y marched  fought it s now up;Netral
why post office was not included in impeachment because been around since pony express one thing every;Netral
this retired republican christian coalition regional director doctor of pharmacy bibl;Netral
